{
    "doc_type": "boleto",
    "schema_version": "1",
    "raw_text": "BANCO BRADESCO 237-2\nLOCAL DE PAGAMENTO: Pagavel em qualquer banco ate o vencimento\nBENEFICIARIO: MANUTENCAO PREDIAL SV LTDA  CNPJ 11.222.333/0001-44\nPAGADOR: SAO VICENTE HOME CLUB  CNPJ 98.765.432/0001-00\nDATA DO DOCUMENTO 05/12/2025  VENCIMENTO 15/12/2025\nNOSSO NUMERO 12345678901-2  NUMERO DO DOCUMENTO 000123\nVALOR DO DOCUMENTO R$ 320,00\nLINHA DIGITAVEL 23793.38128 60082.000123 45678.901020 1 98760000032000\nCODIGO DE BARRAS 23791987600000320003381286008200012345678910",
    "beneficiario": { "nome": "MANUTENCAO PREDIAL SV LTDA", "cnpj_cpf": "11.222.333/0001-44" },
    "pagador": { "nome": "SAO VICENTE HOME CLUB", "cnpj_cpf": "98.765.432/0001-00" },
    "banco": "BANCO BRADESCO 237-2",
    "valor_documento": 320.0,
    "data_vencimento": "15/12/2025",
    "data_documento": "05/12/2025",
    "nosso_numero": "12345678901-2",
    "numero_documento": "000123",
    "linha_digitavel": "23793.38128 60082.000123 45678.901020 1 98760000032000",
    "codigo_barras": "23791987600000320003381286008200012345678910"
}
